{
  "schema_version": "1.0.0",
  "record_type": "study",
  "id": "clarity-ad-lecanemab-early-alzheimers",
  "name": "Clarity AD lecanemab early Alzheimer's disease trial",
  "summary": "An 18-month multicenter randomized phase 3 trial testing lecanemab against placebo in early Alzheimer's disease with amyloid evidence.",
  "study_type": "interventional",
  "status": "completed",
  "phase": "phase3",
  "population": "1795 adults aged 50 to 90 years with early Alzheimer's disease and amyloid evidence by PET or cerebrospinal fluid testing",
  "sample_size": 1795,
  "intervention_ids": [
    "lecanemab"
  ],
  "hallmark_ids": [
    "loss_of_proteostasis"
  ],
  "track_ids": [
    "protein-aggregate-clearance"
  ],
  "endpoint_categories": [
    "biomarker",
    "functional",
    "safety"
  ],
  "source_ids": [
    "pmid-36449413"
  ],
  "registry_ids": [
    "NCT03887455"
  ],
  "dates": {
    "end_date": "2022-11-29"
  },
  "tags": [
    "human",
    "randomized",
    "lecanemab",
    "alzheimers-disease",
    "amyloid-beta"
  ]
}
