{
  "schema_version": "1.0.0",
  "record_type": "study",
  "id": "expdite2-bemdaneprocel-parkinson-phase3",
  "name": "exPDite-2 bemdaneprocel Parkinson disease phase 3 trial",
  "summary": "A recruiting randomized, triple-masked, sham-surgery-controlled phase 3 trial testing bemdaneprocel in adults with Parkinson disease.",
  "study_type": "interventional",
  "status": "recruiting",
  "phase": "phase3",
  "population": "Adults with Parkinson disease eligible for sham-surgery-controlled dopaminergic neuronal cell therapy testing",
  "sample_size": 102,
  "intervention_ids": [
    "bemdaneprocel"
  ],
  "hallmark_ids": [
    "stem_cell_exhaustion"
  ],
  "track_ids": [
    "stem-cell-replacement-and-transplantation"
  ],
  "endpoint_categories": [
    "functional",
    "safety"
  ],
  "source_ids": [
    "nct-06944522"
  ],
  "registry_ids": [
    "NCT06944522"
  ],
  "dates": {
    "start_date": "2025-06-17"
  },
  "trial_details": {
    "registry_last_updated": "2026-05-01",
    "registry_last_checked": "2026-05-01",
    "results_status": "pending",
    "expected_results_window": "No completion date is recorded locally; no near-term result expectation should be assumed.",
    "horizon_note": "The trial is still planned, recruiting, or active in local records and should remain on watch until results are available.",
    "why_it_matters": "Results matter for Stem Cell Replacement and Transplantation because they can show whether the intervention changes function and safety in Adults with Parkinson disease eligible for sham-surgery-controlled dopaminergic neuronal cell therapy testing. That is still narrower than proof of broad aging reversal."
  },
  "tags": [
    "bemdaneprocel",
    "parkinsons",
    "phase3",
    "trial-registry"
  ]
}
