{
  "schema_version": "1.0.0",
  "record_type": "study",
  "id": "maresin1-aged-fracture-healing-mice",
  "name": "Maresin 1 aged mouse tibial fracture healing study",
  "summary": "Aged 24-month-old mice underwent tibial fracture surgery and received vehicle or Maresin 1 beginning 3 days after injury, with inflammatory, callus, bone-deposition, and mechanical repair endpoints.",
  "study_type": "animal",
  "status": "completed",
  "phase": "na",
  "model_system": "Aged 24-month-old mice after tibial fracture surgery, plus aged bone marrow-derived macrophage and stromal-cell culture assays",
  "intervention_ids": [
    "maresin-1"
  ],
  "hallmark_ids": [
    "chronic_inflammation",
    "stem_cell_exhaustion",
    "altered_intercellular_communication"
  ],
  "track_ids": [
    "resolution-pathway-and-tissue-repair"
  ],
  "endpoint_categories": [
    "functional",
    "biomarker",
    "mechanistic"
  ],
  "source_ids": [
    "pmid-32794246"
  ],
  "tags": [
    "animal",
    "maresin-1",
    "bone-regeneration"
  ]
}
