{
  "schema_version": "1.0.0",
  "record_type": "study",
  "id": "clazakizumab-dialysis-il6-phase2b",
  "name": "Clazakizumab dialysis IL-6 phase 2b trial",
  "summary": "A randomized phase 2b dose-finding trial of IL-6 ligand inhibition in maintenance dialysis patients with elevated hsCRP.",
  "study_type": "interventional",
  "status": "completed",
  "phase": "phase2",
  "population": "Adults receiving maintenance dialysis with cardiovascular disease and/or diabetes and hsCRP of at least 2 mg/L",
  "sample_size": 127,
  "intervention_ids": [
    "clazakizumab"
  ],
  "hallmark_ids": [
    "chronic_inflammation"
  ],
  "track_ids": [
    "cytokine-and-inflammasome-modulation"
  ],
  "endpoint_categories": [
    "biomarker",
    "safety"
  ],
  "source_ids": [
    "pmid-38796655"
  ],
  "registry_ids": [
    "NCT05485961"
  ],
  "tags": [
    "human",
    "randomized",
    "phase2",
    "clazakizumab",
    "il-6"
  ]
}
