{
  "schema_version": "1.0.0",
  "record_type": "study",
  "id": "low-igf1-exceptional-longevity-cohort",
  "name": "Low IGF-1 survival study in exceptional longevity families",
  "summary": "Observational study testing whether serum IGF-1 levels predict survival among nonagenarians from an exceptional-longevity cohort.",
  "study_type": "observational",
  "status": "completed",
  "population": "Nonagenarians from families enriched for exceptional longevity",
  "sample_size": 184,
  "intervention_ids": [
    "growth-hormone-igf-axis-attenuation"
  ],
  "hallmark_ids": [
    "deregulated_nutrient_sensing"
  ],
  "track_ids": [
    "insulin-igf-axis-modulation"
  ],
  "endpoint_categories": [
    "lifespan",
    "biomarker"
  ],
  "source_ids": [
    "pmid-24618355"
  ],
  "tags": [
    "human",
    "observational",
    "exceptional-longevity",
    "igf-1",
    "survival"
  ]
}
