{
  "schema_version": "1.0.0",
  "record_type": "study",
  "id": "nad-repletion-aged-mouse-stem-cell-function",
  "name": "NAD+ repletion and aged mouse stem-cell function",
  "summary": "Mouse study testing whether NAD+ repletion can improve mitochondrial and stem-cell function across aged stem-cell compartments.",
  "study_type": "animal",
  "status": "completed",
  "phase": "na",
  "model_system": "Aged mice and tissue stem-cell compartments including muscle and neural stem cells",
  "intervention_ids": [
    "nicotinamide-riboside"
  ],
  "hallmark_ids": [
    "stem_cell_exhaustion",
    "mitochondrial_dysfunction"
  ],
  "track_ids": [
    "stem-cell-rejuvenation",
    "nad-and-redox-restoration"
  ],
  "endpoint_categories": [
    "biomarker",
    "functional",
    "lifespan"
  ],
  "source_ids": [
    "pmid-27127236"
  ],
  "tags": [
    "mouse",
    "nad",
    "nicotinamide-riboside",
    "stem-cell-function"
  ]
}
