{
  "schema_version": "1.0.0",
  "record_type": "study",
  "id": "ds-01-synbiotic-urolithin-butyrate-healthy-adults",
  "name": "DS-01 synbiotic urolithin A and butyrate healthy-adult trial",
  "summary": "Randomized placebo-controlled 91-day healthy-adult trial testing a multi-species synbiotic with pomegranate polyphenol substrate on urolithin A production, fecal butyrate, inflammation, and safety.",
  "study_type": "interventional",
  "status": "completed",
  "phase": "pilot",
  "population": "32 healthy adults randomized to DS-01 or placebo for 91 days",
  "sample_size": 32,
  "intervention_ids": [
    "multi-species-synbiotic-ds-01"
  ],
  "hallmark_ids": [
    "dysbiosis",
    "chronic_inflammation"
  ],
  "track_ids": [
    "microbiome-metabolite-restoration",
    "live-biotherapeutics-and-engineered-microbes",
    "microbiome-composition-modulation"
  ],
  "endpoint_categories": [
    "biomarker",
    "safety",
    "mechanistic"
  ],
  "source_ids": [
    "pmid-40944126"
  ],
  "tags": [
    "human",
    "synbiotic",
    "urolithin-a",
    "butyrate",
    "metabolite-target-engagement"
  ]
}
