{
  "schema_version": "1.0.0",
  "record_type": "study",
  "id": "adipose-exosome-solution-skin-aging-split-face",
  "name": "Adipose stem cell exosome solution skin-aging split-face study",
  "summary": "Twelve-week randomized split-face comparative study of adipose stem cell-derived exosome-containing solution plus microneedling versus saline plus microneedling.",
  "study_type": "interventional",
  "status": "completed",
  "phase": "pilot",
  "population": "Twenty-eight individuals treated for facial skin aging",
  "sample_size": 28,
  "intervention_ids": [
    "adipose-stem-cell-exosome-solution"
  ],
  "hallmark_ids": [
    "altered_intercellular_communication"
  ],
  "track_ids": [
    "extracellular-vesicle-and-secretome-therapies"
  ],
  "endpoint_categories": [
    "biomarker",
    "safety"
  ],
  "source_ids": [
    "pmid-37377400"
  ],
  "tags": [
    "human",
    "exosomes",
    "skin-aging",
    "split-face"
  ]
}
