{
  "schema_version": "1.0.0",
  "record_type": "study",
  "id": "mib-626-covid-aki-rct",
  "name": "MIB-626 COVID-19 acute kidney injury randomized trial",
  "summary": "A 14-day randomized placebo-controlled trial of MIB-626 in hospitalized adults with COVID-19 and acute kidney injury, focused on NAD target engagement, kidney injury, inflammation, disease severity, and safety.",
  "study_type": "interventional",
  "status": "completed",
  "phase": "pilot",
  "population": "Hospitalized adults with COVID-19 and acute kidney injury",
  "sample_size": 42,
  "intervention_ids": [
    "mib-626",
    "nicotinamide-mononucleotide"
  ],
  "hallmark_ids": [
    "mitochondrial_dysfunction"
  ],
  "track_ids": [
    "nad-and-redox-restoration"
  ],
  "endpoint_categories": [
    "biomarker",
    "safety",
    "functional"
  ],
  "source_ids": [
    "pmid-40746868"
  ],
  "tags": [
    "human",
    "randomized",
    "mib-626",
    "disease-context",
    "null-clinical"
  ],
  "registry_ids": [
    "NCT05038488"
  ]
}
