{
  "schema_version": "1.0.0",
  "record_type": "study",
  "id": "twk10-frail-older-adults-rct",
  "name": "TWK10 frail older adults randomized trial",
  "summary": "Randomized, double-blind trial testing Lactobacillus plantarum TWK10 low-dose or high-dose supplementation versus placebo for muscle mass and functional performance in frail older adults.",
  "study_type": "interventional",
  "status": "completed",
  "phase": "na",
  "population": "Adults aged 55 to 85 years with mild frailty grades 1 to 4",
  "sample_size": 55,
  "intervention_ids": [
    "lactiplantibacillus-plantarum-twk10"
  ],
  "hallmark_ids": [
    "dysbiosis"
  ],
  "track_ids": [
    "live-biotherapeutics-and-engineered-microbes"
  ],
  "endpoint_categories": [
    "functional",
    "biomarker",
    "safety"
  ],
  "source_ids": [
    "pmid-34361902"
  ],
  "registry_ids": [
    "NCT04893746"
  ],
  "dates": {
    "start_date": "2020-07-01",
    "end_date": "2021-04-30"
  },
  "tags": [
    "human",
    "randomized-trial",
    "twk10",
    "frailty",
    "muscle-function"
  ]
}
