{
  "schema_version": "1.0.0",
  "record_type": "study",
  "id": "neutral-blood-exchange-plasma-dilution-mice-human-tpe",
  "name": "Neutral blood exchange and plasma dilution rejuvenation study",
  "summary": "Aged mice underwent neutral blood exchange with saline-albumin replacement, with human therapeutic plasma exchange serum context included for translational comparison.",
  "study_type": "animal",
  "status": "completed",
  "phase": "na",
  "model_system": "Aged mice receiving plasma dilution through neutral blood exchange, with human TPE serum analyses",
  "intervention_ids": [
    "neutral-blood-exchange",
    "therapeutic-plasma-exchange"
  ],
  "hallmark_ids": [
    "altered_intercellular_communication",
    "chronic_inflammation",
    "stem_cell_exhaustion"
  ],
  "track_ids": [
    "circulating-factor-modulation"
  ],
  "endpoint_categories": [
    "functional",
    "biomarker",
    "mechanistic"
  ],
  "source_ids": [
    "pmid-32474458"
  ],
  "tags": [
    "animal",
    "plasma-dilution",
    "neutral-blood-exchange"
  ]
}
