{
  "schema_version": "1.0.0",
  "record_type": "study",
  "id": "lean-donor-fmt-metabolic-syndrome",
  "name": "Lean-donor intestinal microbiota transfer in metabolic syndrome",
  "summary": "Randomized human study comparing allogenic lean-donor versus autologous intestinal microbiota infusion in male recipients with metabolic syndrome, with insulin sensitivity and microbiota composition readouts at six weeks.",
  "study_type": "interventional",
  "status": "completed",
  "phase": "pilot",
  "population": "Male adults with metabolic syndrome",
  "sample_size": 18,
  "intervention_ids": [
    "fecal-microbiota-transplantation"
  ],
  "hallmark_ids": [
    "dysbiosis",
    "deregulated_nutrient_sensing"
  ],
  "track_ids": [
    "ecosystem-replacement"
  ],
  "endpoint_categories": [
    "biomarker",
    "mechanistic"
  ],
  "source_ids": [
    "pmid-22728514"
  ],
  "registry_ids": [
    "NTR1776"
  ],
  "tags": [
    "human",
    "metabolic-syndrome",
    "insulin-sensitivity",
    "human-biomarker"
  ]
}
