{
  "schema_version": "1.0.0",
  "record_type": "study",
  "id": "ni006-attr-cm-phase1",
  "name": "NI006 ATTR cardiomyopathy phase 1 trial",
  "summary": "A phase 1 randomized dose-escalation trial testing the anti-ATTR antibody NI006 for safety and amyloid-load biomarkers in ATTR cardiomyopathy.",
  "study_type": "interventional",
  "status": "completed",
  "phase": "phase1",
  "population": "40 patients with wild-type or variant ATTR cardiomyopathy and chronic heart failure",
  "sample_size": 40,
  "intervention_ids": [
    "ni006"
  ],
  "hallmark_ids": [
    "loss_of_proteostasis"
  ],
  "track_ids": [
    "protein-aggregate-clearance"
  ],
  "endpoint_categories": [
    "biomarker",
    "safety"
  ],
  "source_ids": [
    "pmid-37212440"
  ],
  "registry_ids": [
    "NCT04360434"
  ],
  "tags": [
    "human",
    "phase1",
    "ni006",
    "attr-cm",
    "amyloid-depletion"
  ]
}
