{
  "schema_version": "1.0.0",
  "record_type": "study",
  "id": "metformin-frailty-prevention-high-risk-older-adults",
  "name": "Metformin frailty-prevention trial in high-risk older adults",
  "summary": "A ClinicalTrials.gov phase 2 randomized metformin frailty-prevention trial in community-dwelling older adults with prediabetes or impaired glucose tolerance, completed with posted registry results.",
  "study_type": "interventional",
  "status": "completed",
  "phase": "phase2",
  "population": "Community-dwelling adults aged 65 to 90 years with prediabetes or impaired glucose tolerance and without baseline frailty",
  "sample_size": 141,
  "intervention_ids": [
    "metformin"
  ],
  "hallmark_ids": [
    "deregulated_nutrient_sensing"
  ],
  "track_ids": [
    "ampk-and-metabolic-modulators"
  ],
  "endpoint_categories": [
    "functional",
    "safety"
  ],
  "source_ids": [
    "nct-02570672"
  ],
  "registry_ids": [
    "NCT02570672"
  ],
  "tags": [
    "human",
    "metformin",
    "frailty",
    "trial-registry"
  ]
}
