{
  "schema_version": "1.0.0",
  "record_type": "study",
  "id": "ta65-metabolic-syndrome-terminated-registry",
  "name": "TA-65 metabolic syndrome terminated registry",
  "summary": "Terminated randomized double-masked crossover phase 1 TA-65 registry in metabolic syndrome or insulin resistance, with plasma insulin as the primary outcome.",
  "study_type": "interventional",
  "status": "terminated",
  "phase": "phase1",
  "population": "13 adults aged 35 to 70 years with metabolic syndrome or insulin resistance",
  "sample_size": 13,
  "intervention_ids": [
    "ta-65"
  ],
  "hallmark_ids": [
    "telomere_attrition"
  ],
  "track_ids": [
    "telomerase-restoration"
  ],
  "endpoint_categories": [
    "biomarker",
    "safety"
  ],
  "source_ids": [
    "nct-01753674"
  ],
  "registry_ids": [
    "NCT01753674"
  ],
  "trial_details": {
    "registry_last_updated": "2015-05-28",
    "registry_last_checked": "2026-06-10",
    "completion_date_kind": "actual",
    "results_status": "not_posted",
    "expected_results_window": "The registry listed actual primary and study completion in June 2014, then termination with 13 enrolled participants and no posted results in the June 10, 2026 API view.",
    "horizon_note": "The terminated no-results status is limiting context for the TA-65 clinical record.",
    "why_it_matters": "Termination and small enrollment reduce the chance that this registry will supply interpretable human telomerase-restoration evidence."
  },
  "tags": [
    "human",
    "ta-65",
    "trial-registry",
    "metabolic-syndrome",
    "terminated",
    "no-results",
    "coverage-repair"
  ]
}
