{
  "schema_version": "1.0.0",
  "record_type": "study",
  "id": "urolithin-a-obesity-vascular-mitochondrial-registry",
  "name": "Urolithin A obesity vascular mitochondrial registry",
  "summary": "Completed randomized triple-masked trial testing urolithin A versus placebo for 28 days in 50 middle-aged adults with obesity, with arterial function and local stiffness as the primary endpoint and vascular, cerebral blood-flow, nitric-oxide, and mitochondrial biomarker secondary endpoints.",
  "study_type": "interventional",
  "status": "completed",
  "phase": "na",
  "population": "50 adults aged 40 to 64 years with obesity",
  "sample_size": 50,
  "intervention_ids": [
    "urolithin-a"
  ],
  "hallmark_ids": [
    "dysbiosis",
    "mitochondrial_dysfunction"
  ],
  "track_ids": [
    "microbiome-metabolite-restoration",
    "mitophagy-enhancers"
  ],
  "endpoint_categories": [
    "biomarker",
    "mechanistic"
  ],
  "source_ids": [
    "nct-05921266"
  ],
  "registry_ids": [
    "NCT05921266"
  ],
  "dates": {
    "start_date": "2023-10-02",
    "end_date": "2025-05-14"
  },
  "trial_details": {
    "registry_last_updated": "2025-06-26",
    "registry_last_checked": "2026-06-10",
    "primary_completion_date": "2025-05-14",
    "study_completion_date": "2025-05-14",
    "completion_date_kind": "actual",
    "results_status": "not_posted",
    "expected_results_window": "The registry listed actual completion on May 14, 2025 and had no posted results in the June 10, 2026 API view.",
    "horizon_note": "Completed no-results trial-watch context.",
    "why_it_matters": "Posted results could clarify whether urolithin A changes vascular and mitochondrial biomarkers in a metabolically stressed middle-aged population, but current no-results status cannot improve the public evidence stage."
  },
  "tags": [
    "human",
    "urolithin-a",
    "middle-aged-adults",
    "obesity",
    "trial-registry",
    "completed",
    "no-results",
    "coverage-repair"
  ]
}
