{
  "schema_version": "1.0.0",
  "record_type": "study",
  "id": "fisetin-frailty-older-adults-registry",
  "name": "AFFIRM-LITE fisetin frailty and inflammation registry",
  "summary": "Phase 2 randomized double-blind placebo-controlled fisetin trial in older adults, using blood inflammation markers as the primary endpoint and with no posted results in the June 11, 2026 ClinicalTrials.gov API check.",
  "study_type": "interventional",
  "status": "recruiting",
  "phase": "phase2",
  "population": "Older adults in an invitation-enrolling fisetin frailty and inflammation study.",
  "sample_size": 40,
  "intervention_ids": [
    "fisetin"
  ],
  "hallmark_ids": [
    "cellular_senescence",
    "chronic_inflammation"
  ],
  "track_ids": [
    "senolytics"
  ],
  "endpoint_categories": [
    "biomarker",
    "functional",
    "safety"
  ],
  "source_ids": [
    "nct-03675724"
  ],
  "registry_ids": [
    "NCT03675724"
  ],
  "dates": {
    "start_date": "2018-11-15",
    "end_date": "2027-11-01"
  },
  "trial_details": {
    "registry_last_updated": "2026-05-19",
    "registry_last_checked": "2026-06-11",
    "primary_completion_date": "2026-11-01",
    "study_completion_date": "2027-11-01",
    "completion_date_kind": "estimated",
    "results_status": "not_posted",
    "horizon_note": "Month-only registry dates were normalized to the first day of the month in structured fields.",
    "why_it_matters": "AFFIRM-LITE is a direct aging-relevant fisetin trial, but it is no-results context until data are posted."
  },
  "tags": [
    "senolytics",
    "fisetin",
    "human",
    "frailty",
    "trial-registry",
    "no-results",
    "coverage-repair"
  ]
}
