{
  "schema_version": "1.0.0",
  "record_type": "study",
  "id": "platelet-ev-wound-healing-phase1",
  "name": "Plexoval II platelet extracellular vesicle wound-healing phase I trial",
  "summary": "Randomized double-blind placebo-controlled within-person phase I trial testing LEAP-purified allogeneic platelet-derived extracellular vesicles in healthy-volunteer punch-biopsy wounds.",
  "study_type": "interventional",
  "status": "completed",
  "phase": "phase1",
  "population": "Healthy adult volunteers with two induced punch-biopsy wounds",
  "sample_size": 11,
  "intervention_ids": [
    "platelet-derived-extracellular-vesicles"
  ],
  "hallmark_ids": [
    "altered_intercellular_communication"
  ],
  "track_ids": [
    "extracellular-vesicle-and-secretome-therapies"
  ],
  "endpoint_categories": [
    "safety",
    "functional"
  ],
  "source_ids": [
    "pmid-37353884"
  ],
  "registry_ids": [
    "ACTRN12620000944932"
  ],
  "dates": {
    "start_date": "2020-09-22",
    "end_date": "2021-01-15"
  },
  "trial_details": {
    "registry_last_updated": "2021-03-26",
    "registry_last_checked": "2026-06-15",
    "primary_completion_date": "2021-01-15",
    "study_completion_date": "2021-01-15",
    "completion_date_kind": "actual",
    "results_status": "posted",
    "results_first_posted_date": "2021-03-26",
    "horizon_note": "Results are already in the public evidence layer; ANZCTR also records a March 26, 2021 results-provided date and an automatically linked 2023 publication.",
    "why_it_matters": "Results matter for Extracellular Vesicle and Secretome Therapies because they can show whether the intervention changes safety and function in Healthy adult volunteers with two induced punch-biopsy wounds. That is still narrower than proof of broad aging reversal."
  },
  "tags": [
    "human",
    "platelet-evs",
    "wound-healing",
    "phase1"
  ]
}
