{
  "schema_version": "1.0.0",
  "record_type": "study",
  "id": "lamp2a-cma-aging-liver",
  "name": "LAMP-2A preservation in aged mouse liver",
  "summary": "Aged liver-specific Tet-off-LAMP-2A transgenic mouse experiments testing whether preserving chaperone-mediated autophagy limits age-associated liver damage and functional decline.",
  "study_type": "animal",
  "status": "completed",
  "model_system": "Aged liver-specific Tet-off-LAMP-2A transgenic mice compared with aged and young wild-type controls",
  "intervention_ids": [
    "lamp2a-expression-preservation"
  ],
  "hallmark_ids": [
    "disabled_macroautophagy"
  ],
  "track_ids": [
    "lysosomal-restoration"
  ],
  "endpoint_categories": [
    "functional",
    "mechanistic"
  ],
  "source_ids": [
    "pmid-18690243"
  ],
  "tags": [
    "animal",
    "mouse",
    "lamp2a",
    "chaperone-mediated-autophagy"
  ]
}
