{
  "schema_version": "1.0.0",
  "record_type": "study",
  "id": "triim-x-extension-registry",
  "name": "TRIIM-X extension registry study",
  "summary": "A randomized phase 2 registry study of a TRIIM-style combination regimen with epigenetic age, thymus regeneration, safety, and immunosenescence endpoints.",
  "study_type": "interventional",
  "status": "recruiting",
  "phase": "phase2",
  "population": "Adults aged 40 to 80 years",
  "sample_size": 85,
  "intervention_ids": [
    "triim-regimen"
  ],
  "hallmark_ids": [
    "epigenetic_alterations",
    "altered_intercellular_communication"
  ],
  "track_ids": [
    "dna-methylation-and-epigenome-restoration",
    "neuroendocrine-and-systemic-signal-reset"
  ],
  "endpoint_categories": [
    "biomarker",
    "safety",
    "functional"
  ],
  "source_ids": [
    "nct-04375657"
  ],
  "registry_ids": [
    "NCT04375657"
  ],
  "tags": [
    "human",
    "trial-registry",
    "phase2",
    "endocrine-regimen",
    "no-posted-results"
  ]
}
