{
  "schema_version": "1.0.0",
  "record_type": "study",
  "id": "laromestrocel-aging-frailty-phase2b",
  "name": "Laromestrocel aging frailty phase 2b trial",
  "summary": "A randomized, blinded, placebo-controlled phase 2b dose-finding trial testing a single infusion of allogeneic mesenchymal stem cells in older adults with aging frailty.",
  "study_type": "interventional",
  "status": "completed",
  "phase": "phase2",
  "population": "Ambulatory adults aged 70 to 85 with aging frailty and hypomobility",
  "sample_size": 148,
  "intervention_ids": [
    "laromestrocel"
  ],
  "hallmark_ids": [
    "stem_cell_exhaustion",
    "altered_intercellular_communication"
  ],
  "track_ids": [
    "stem-cell-replacement-and-transplantation"
  ],
  "endpoint_categories": [
    "functional",
    "biomarker",
    "safety"
  ],
  "source_ids": [
    "pmid-41747733"
  ],
  "registry_ids": [
    "NCT03169231"
  ],
  "dates": {
    "start_date": "2017-07-06",
    "end_date": "2021-09-30"
  },
  "trial_details": {
    "registry_last_updated": "2022-03-07",
    "registry_last_checked": "2026-06-14",
    "primary_completion_date": "2021-09-30",
    "study_completion_date": "2021-09-30",
    "completion_date_kind": "actual",
    "results_status": "posted",
    "horizon_note": "Results are already in the public evidence layer, so this is not an open no-result watch item.",
    "why_it_matters": "Results matter for Stem Cell Replacement and Transplantation because they can show whether the intervention changes function, biomarkers, and safety in Ambulatory adults aged 70 to 85 with aging frailty and hypomobility. That is still narrower than proof of broad aging reversal."
  },
  "tags": [
    "laromestrocel",
    "frailty",
    "phase2b",
    "human"
  ]
}
