{
  "schema_version": "1.0.0",
  "record_type": "study",
  "id": "spm-emulsion-pad-healthy-volunteers",
  "name": "SPM marine oil peripheral artery disease and healthy-volunteer study",
  "summary": "A short-course enriched marine oil study in healthy volunteers and people with symptomatic peripheral artery disease, with lipid mediator, leukocyte phenotype, and macrophage gene-expression endpoints.",
  "study_type": "interventional",
  "status": "completed",
  "phase": "na",
  "population": "Healthy volunteers and participants with symptomatic peripheral artery disease; the publication reports 10 healthy volunteers and 10 PAD participants, while the registry records 30 actual enrollees across PAD, OA, and healthy groups",
  "sample_size": 30,
  "intervention_ids": [
    "spm-enriched-marine-oil"
  ],
  "hallmark_ids": [
    "chronic_inflammation",
    "altered_intercellular_communication"
  ],
  "track_ids": [
    "resolution-pathway-and-tissue-repair"
  ],
  "endpoint_categories": [
    "biomarker",
    "mechanistic",
    "functional"
  ],
  "source_ids": [
    "pmid-32696697",
    "nct-02719665"
  ],
  "registry_ids": [
    "NCT02719665"
  ],
  "dates": {
    "start_date": "2016-03-01",
    "end_date": "2020-12-15"
  },
  "tags": [
    "human-biomarker",
    "spm",
    "peripheral-artery-disease"
  ]
}
