{
  "schema_version": "1.0.0",
  "record_type": "study",
  "id": "restor-mtori-older-adults-registry",
  "name": "RESTOR mTOR inhibitor older-adults registry",
  "summary": "Recruiting randomized double-masked early phase 1 PK/PD trial of rapamycin and everolimus in healthy adults aged 65 to 90, designed to identify dosing that safely inhibits mTOR to levels seen in young healthy persons.",
  "study_type": "interventional",
  "status": "recruiting",
  "phase": "phase1",
  "population": "Community-dwelling healthy older adults aged 65 to 90 years",
  "sample_size": 194,
  "intervention_ids": [
    "sirolimus",
    "everolimus"
  ],
  "hallmark_ids": [
    "deregulated_nutrient_sensing"
  ],
  "track_ids": [
    "rapalogs"
  ],
  "endpoint_categories": [
    "mechanistic",
    "biomarker",
    "safety"
  ],
  "source_ids": [
    "nct-06658093"
  ],
  "registry_ids": [
    "NCT06658093"
  ],
  "dates": {
    "start_date": "2026-03-04"
  },
  "trial_details": {
    "registry_last_updated": "2026-06-01",
    "registry_last_checked": "2026-06-11",
    "primary_completion_date": "2028-07-01",
    "study_completion_date": "2028-07-01",
    "completion_date_kind": "estimated",
    "results_status": "not_posted",
    "expected_results_window": "The registry listed estimated primary and study completion in July 2028 and had no posted results in the June 11, 2026 API view.",
    "horizon_note": "Recruiting no-results PK/PD and dose-timing context.",
    "why_it_matters": "RESTOR directly targets a central Rapalogs uncertainty: whether rapamycin or everolimus can safely produce interpretable mTOR inhibition in older human tissues with sex-appropriate dosing."
  },
  "tags": [
    "human",
    "sirolimus",
    "everolimus",
    "mTOR",
    "pharmacology",
    "older-adults",
    "trial-registry",
    "recruiting",
    "no-results",
    "coverage-repair"
  ]
}
